{
  "artifact_type": "run.control",
  "schema_version": "1.0",
  "status": "active",
  "run_id": "2026-06-27-information-sufficiency-gate",
  "control_level": 3,
  "target_model": {
    "result_orientation": [
      "state_change",
      "design_model"
    ],
    "result_content": "specified",
    "path": "partially_known",
    "result_placement": "multi_place",
    "impact_scope": "persistent_internal"
  },
  "strategy_policy": "reviewed_replanning",
  "gate_mode": "human_gate",
  "phase_structure": "staged",
  "current_generation": "gen-000",
  "max_auto_amendment_rounds": 2,
  "semantic_base_ref": {
    "id": "semantic-base:information-sufficiency-gate",
    "hash": "sha256:8072c67614d58240ba1b9ad837e926ab5abbb1dee954f83ef7f5bc20984fd197"
  },
  "amendment_policy": {
    "may_change": [
      "required_step_refinement",
      "work_packages",
      "instrumentation",
      "verifier_configuration",
      "implementation_sequence",
      "test_fixture_details"
    ],
    "must_not_change_without_human": [
      "semantic_base",
      "source_requirements",
      "required_outcomes",
      "what_counts_as_done",
      "authority",
      "counterexample_gate_contract",
      "information_sufficiency_quality_standard"
    ]
  },
  "generations": [
    {
      "id": "gen-000",
      "strategy_kind": "execution",
      "status": "active",
      "runtime": "gen-000/runtime.control.json",
      "review": "gen-000/review.control.json",
      "writable_evidence_paths": [
        "schemas/control-json/",
        ".agents/skills/analyzing-cybernetic-requirements/",
        ".agents/skills/compiling-cybernetic-runtime-goals/",
        ".agents/skills/orchestrating-cybernetic-pregoal/",
        ".agents/skills/using-control-json/",
        "tests/skills/",
        "docs/cybernetics/runs/2026-06-27-information-sufficiency-gate/evidence/"
      ],
      "required_steps": [
        {
          "step_id": "S1-info-sufficiency-schema-and-requirements-model",
          "transition": "No official information_sufficiency_check model -> schema-backed requirements-stage model for derived facts with why_needed, acceptable_evidence, current_status, and evidence_ref.",
          "evidence": [
            "E-info-sufficiency-schema-code",
            "E-info-sufficiency-schema-tests"
          ],
          "satisfies_outcomes": [
            "O-information-sufficiency-requirements-and-schema"
          ]
        },
        {
          "step_id": "S2-pre-design-plan-guard-and-orchestrator-entry-block",
          "transition": "Design/plan can start without factual sufficiency -> guard and orchestrator block design/plan entry until sufficiency is satisfied or human escalation is recorded.",
          "evidence": [
            "E-entry-block-guard-code",
            "E-entry-block-guard-tests",
            "E-modification-surface-analysis"
          ],
          "satisfies_outcomes": [
            "O-guard-and-orchestrator-block-entry"
          ]
        },
        {
          "step_id": "S3-independent-counterexample-review-enforcement",
          "transition": "Counterexample review can be optional or self-approved -> independent Counter Example Gate is required for information sufficiency and per-outcome checks before approval.",
          "evidence": [
            "E-independent-counterexample-review-report"
          ],
          "satisfies_outcomes": [
            "O-independent-counterexample-review"
          ]
        },
        {
          "step_id": "S4-runtime-protocol-missing-fact-handling",
          "transition": "Runtime can discover missing pre-design facts and continue ad hoc -> runtime protocol preserves missing facts as control issues requiring reviewed amendment or human decision.",
          "evidence": [
            "E-runtime-protocol-code-doc",
            "E-runtime-protocol-tests"
          ],
          "satisfies_outcomes": [
            "O-runtime-protocol-handles-new-missing-facts"
          ]
        },
        {
          "step_id": "S5-historical-regressions-and-acceptance-checks",
          "transition": "Historical missing-information failures are untested -> executable regressions cover client integration minimal facts, self-filled observation lists, absent independent review, and runtime-discovered missing pre-design facts.",
          "evidence": [
            "E-historical-regression-fixtures",
            "E-historical-regression-command"
          ],
          "satisfies_outcomes": [
            "O-historical-regressions-and-acceptance-checks"
          ]
        }
      ],
      "verifier": {
        "required_before_goal_achieved": true,
        "command": "python3 .agents/skills/using-control-json/scripts/verify_runtime_progress.py",
        "required_outcomes": [
          "O-information-sufficiency-requirements-and-schema",
          "O-guard-and-orchestrator-block-entry",
          "O-independent-counterexample-review",
          "O-runtime-protocol-handles-new-missing-facts",
          "O-historical-regressions-and-acceptance-checks"
        ],
        "output_schema": "final-report.schema.json"
      }
    }
  ]
}
